{
  "id": "019a2b3c-4d5e-7f00-8a00-000000000001",
  "name": "Telephely A",
  "address": "1051 Budapest, Példa utca 1.",
  "timezone": "Europe/Budapest",
  "no_data_alert_after_min": 120,
  "created_by": "019a2b3c-4d5e-7f00-8a00-000000000002",
  "created_at": "2026-10-20T08:00:00.000Z",
  "updated_at": "2026-10-27T10:05:12.345Z"
}
